{
  "schema_version": "AGL_LITE_V1_2_1",
  "project_id": "AGL-LITE-EXAMPLE",
  "policy_version": "policy-v1.2.1",
  "created_at_utc": "2026-10-27T00:00:00Z",
  "message_id": "MSG-001",
  "event_id": "EV-001",
  "task_id": "TASK-001",
  "sender": "AGENT_A",
  "recipients": [
    "AGENT_A",
    "AGENT_B"
  ],
  "stream_id": "STREAM-001",
  "stream_seq": 1,
  "payload_ref": "messages/MSG-001.json",
  "idempotency_key": "MSG-001:STREAM-001:1",
  "delivery_status": "COMMITTED"
}
